{
  "framework": "levels-of-interoperability",
  "version": "0.1.0",
  "lastUpdated": "2026-05-22",
  "entries": [
    {
      "id": "X01",
      "order": 10,
      "kind": "level-to-level",
      "from": ["T01"],
      "to": ["T02"],
      "description": "From tacit to locally described.",
      "resourcesAffectedAllResources": true,
      "workRequired": "Labelling, dating, locating, basic record-keeping.",
      "toolsAndServicesInvolved": ["S13", "S14"],
      "notes": "The fundamental move, often the hardest because it requires habit change."
    },
    {
      "id": "X02",
      "order": 20,
      "kind": "level-to-level",
      "from": ["T02"],
      "to": ["T03"],
      "description": "From informal local description to documented local schema.",
      "resourcesAffected": ["R03", "R04", "R05", "R06", "R07", "R08", "R09", "R10", "R11", "R12", "R13", "R14", "R15", "R16"],
      "resourcesAffectedNotes": "R03 through R16.",
      "workRequired": "Define and document a local schema with required and optional fields.",
      "toolsAndServicesInvolved": ["S01", "S02", "S13", "S14"],
      "notes": "The point at which the work becomes shareable within a team."
    },
    {
      "id": "X03",
      "order": 30,
      "kind": "level-to-level",
      "from": ["T03"],
      "to": ["T04a"],
      "description": "From local schema to informal or emerging shared schema.",
      "resourcesAffected": ["R03", "R04", "R05", "R06", "R07", "R08", "R09", "R10", "R11", "R12", "R13", "R14", "R15", "R16"],
      "workRequired": "Adopt or align with a schema used beyond the project.",
      "toolsAndServicesInvolved": ["S02", "S05", "S14"],
      "notes": "May involve participation in emerging community efforts."
    },
    {
      "id": "X04",
      "order": 40,
      "kind": "level-to-level",
      "from": ["T04a"],
      "to": ["T04b"],
      "description": "From emerging to accepted shared schema.",
      "resourcesAffected": ["R03", "R04", "R05", "R06", "R07", "R08", "R09", "R10", "R11", "R12", "R13", "R14", "R15", "R16"],
      "workRequired": "Adopt or align with a community-endorsed schema.",
      "toolsAndServicesInvolved": ["S02", "S05"],
      "notes": "May require remapping of existing records."
    },
    {
      "id": "X05",
      "order": 50,
      "kind": "level-to-level",
      "from": ["T03", "T04a", "T04b"],
      "fromNotes": "T03 or T04 (a or b).",
      "to": ["T05"],
      "description": "Aligning values to published vocabularies.",
      "resourcesAffected": ["R13"],
      "resourcesAffectedNotes": "R13, plus vocabulary-controlled fields in other resources.",
      "workRequired": "Map local terms to AAT, Wikidata, domain thesauri.",
      "toolsAndServicesInvolved": ["S03", "S06"],
      "notes": "Often happens incrementally, field by field."
    },
    {
      "id": "X06",
      "order": 60,
      "kind": "level-to-level",
      "from": ["T03", "T04a", "T04b", "T05"],
      "fromNotes": "T03 or T04 (a or b) or T05.",
      "to": ["T06"],
      "description": "Assigning persistent identifiers.",
      "resourcesAffected": ["R03", "R05", "R06", "R07", "R08", "R10", "R11", "R12", "R16"],
      "workRequired": "Mint and register PIDs for resources and entities.",
      "toolsAndServicesInvolved": ["S07"],
      "notes": "Often happens independently of T05, can be parallel."
    },
    {
      "id": "X07",
      "order": 70,
      "kind": "level-to-level",
      "from": ["T06"],
      "to": ["T06+"],
      "description": "Enriching PID-bearing metadata with optional context.",
      "resourcesAffected": ["R03", "R04", "R05", "R06", "R07", "R08", "R09", "R10", "R11", "R12", "R13", "R14", "R15", "R16"],
      "workRequired": "Populate optional fields, link related resources at metadata level.",
      "toolsAndServicesInvolved": ["S02", "S13"],
      "notes": "A legitimate plateau, many projects will stay here."
    },
    {
      "id": "X08",
      "order": 80,
      "kind": "level-to-level",
      "from": ["T04b", "T06+"],
      "to": ["T07a"],
      "description": "Ad hoc semantic representation.",
      "resourcesAffected": ["R03", "R04", "R05", "R06", "R07", "R08", "R09", "R10", "R11", "R12", "R13", "R14", "R15", "R16"],
      "workRequired": "Apply CIDOC CRM or extensions, possibly without recommended templates.",
      "toolsAndServicesInvolved": ["S09"],
      "notes": "Common but limited route, may need rework to reach T07b."
    },
    {
      "id": "X09",
      "order": 90,
      "kind": "level-to-level",
      "from": ["T04b", "T06+"],
      "to": ["T07b"],
      "description": "Semantic representation against recommended implementations.",
      "resourcesAffected": ["R03", "R04", "R05", "R06", "R07", "R08", "R09", "R10", "R11", "R12", "R13", "R14", "R15", "R16"],
      "workRequired": "Apply recommended templates, document modelling choices.",
      "toolsAndServicesInvolved": ["S04", "S08", "S09", "S17"],
      "notes": "The strategic route, supports automated lifts."
    },
    {
      "id": "X10",
      "order": 100,
      "kind": "level-to-level",
      "from": ["T07a"],
      "to": ["T07b"],
      "description": "Aligning ad hoc semantic representation to recommended implementations.",
      "resourcesAffected": ["R03", "R04", "R05", "R06", "R07", "R08", "R09", "R10", "R11", "R12", "R13", "R14", "R15", "R16"],
      "workRequired": "Refactor existing semantic data to match recommended templates.",
      "toolsAndServicesInvolved": ["S04", "S08", "S17"],
      "notes": "May be substantial work, depends on how far ad hoc representations diverged."
    },
    {
      "id": "X11",
      "order": 110,
      "kind": "level-to-level",
      "from": ["T06+"],
      "to": ["T08a"],
      "description": "Federating metadata-level resources.",
      "resourcesAffected": ["R03", "R04", "R05", "R06", "R07", "R08", "R09", "R10", "R11", "R12", "R13", "R14", "R15", "R16"],
      "workRequired": "Publish metadata as linked data, register with aggregators.",
      "toolsAndServicesInvolved": ["S10", "S16"],
      "notes": "Metadata-level federation, no full semantic layer required."
    },
    {
      "id": "X12",
      "order": 120,
      "kind": "level-to-level",
      "from": ["T07b"],
      "to": ["T08b"],
      "description": "Federating semantic representations.",
      "resourcesAffected": ["R03", "R04", "R05", "R06", "R07", "R08", "R09", "R10", "R11", "R12", "R13", "R14", "R15", "R16"],
      "workRequired": "Publish semantic representations as resolvable linked data.",
      "toolsAndServicesInvolved": ["S09", "S10"],
      "notes": "Full semantic federation."
    },
    {
      "id": "X13",
      "order": 130,
      "kind": "level-to-level",
      "from": ["T08b"],
      "to": ["T09"],
      "description": "Assembling resources into a documented Digital Twin.",
      "resourcesAffected": ["R03", "R04", "R05", "R06", "R07", "R08", "R09", "R10", "R11", "R12", "R13", "R14", "R15", "R16"],
      "workRequired": "Specify the Digital Twin structure, assemble resources accordingly.",
      "toolsAndServicesInvolved": ["S11", "S12"],
      "notes": "Depends on Digital Twin specification work."
    },
    {
      "id": "X14",
      "order": 140,
      "kind": "downward",
      "fromNotes": "Any higher level.",
      "toNotes": "Any lower level.",
      "description": "Exporting from a higher level to a lower level for exchange with partners working at that level.",
      "resourcesAffected": ["R03", "R04", "R05", "R06", "R07", "R08", "R09", "R10", "R11", "R12", "R13", "R14", "R15", "R16"],
      "workRequired": "Generate simpler representations from richer ones.",
      "toolsAndServicesInvolved": ["S05", "S06", "S08"],
      "notes": "The bidirectional flow that distinguishes the framework from a one-way stack."
    },
    {
      "id": "X15",
      "order": 150,
      "kind": "cross-cutting",
      "description": "Accessibility improvement: moving a resource from restricted to documented or open access at any level.",
      "resourcesAffectedAllResources": true,
      "workRequired": "Storage migration, licensing review, access policy work.",
      "toolsAndServicesInvolved": ["S13", "S14", "S16"],
      "notes": "Cuts across all levels, often the bottleneck. Closely related to but distinct from X17 (licensing)."
    },
    {
      "id": "X16",
      "order": 160,
      "kind": "cross-cutting",
      "description": "Scope expansion: moving a resource from individual to project or institutional scope.",
      "resourcesAffected": ["R01", "R02", "R04", "R09", "R13", "R14", "R15"],
      "workRequired": "Documentation, handover, archival deposit.",
      "toolsAndServicesInvolved": ["S13", "S14"],
      "notes": "Particularly relevant at T02 and T03."
    },
    {
      "id": "X17",
      "order": 170,
      "kind": "cross-cutting",
      "description": "Licensing improvement: applying or clarifying re-use licences for a resource at any level. Moves from no licence stated, through bespoke terms, towards machine-readable open licences. A FAIR-R consideration that applies at every level from T02 upward.",
      "resourcesAffectedAllResources": true,
      "workRequired": "Review of re-use intentions, selection of appropriate licence (Creative Commons, Open Data Commons, or domain-specific), application to records and metadata, registration of licence in relevant infrastructure (repository deposits, PID metadata, aggregator records).",
      "toolsAndServicesInvolved": ["S13", "S14", "S16"],
      "notes": "Often treated together with accessibility but conceptually distinct. A resource can be openly accessible without a clear re-use licence, leaving re-users in a legal grey area, or can be access-restricted with a clear licence that applies once access is granted. Becomes increasingly important at T04b and above where aggregator and federation infrastructures typically require explicit licensing."
    }
  ]
}
